{
  "tenant_state_id": "ogun",
  "policy_id": "POL_REVENUE_SPLIT_LUC_2026",
  "revenue_head": "REV_LAND_USE_CHARGE",
  "effective_date": "2026-01-01",
  "gazette_reference": "Ogun State Land Use Charge Regulations (LUC Reform enforcement)",
  "statutory_split_rules": [
    {
      "beneficiary": "STATE_CONSOLIDATED_REVENUE_FUND",
      "tigerbeetle_account_code": 3001,
      "split_percentage": 75.0,
      "deduction_timing": "INSTANT"
    },
    {
      "beneficiary": "MDA_RETENTION_ACCOUNT",
      "beneficiary_detail": "OGUN_BUREAU_OF_LANDS_RETENTION",
      "tigerbeetle_account_code": 2010,
      "split_percentage": 15.0,
      "deduction_timing": "INSTANT"
    },
    {
      "beneficiary": "PPP_TECH_CONCESSIONAIRE_ESCROW",
      "tigerbeetle_account_code": 2099,
      "split_percentage": 8.0,
      "deduction_timing": "INSTANT"
    },
    {
      "beneficiary": "LOCAL_GOVERNMENT_SHARE_POOL",
      "tigerbeetle_account_code": 2020,
      "split_percentage": 2.0,
      "deduction_timing": "END_OF_MONTH"
    }
  ],
  "concession_guardrails": {
    "revenue_share_ceiling_pct": 8,
    "irr_cap_pct": 22,
    "step_down_schedule": [
      { "up_to_cumulative_igr_kobo": 500000000000, "share_pct": 8.0 },
      { "up_to_cumulative_igr_kobo": 1500000000000, "share_pct": 5.0 },
      { "up_to_cumulative_igr_kobo": 0, "share_pct": 3.0 }
    ]
  }
}
